id,quest,shortname,item01,item02,item03,item04,item05,item06,item07,item08,item09,item10,item11,item12,item13,item14,item15,item16
94074701,まつろわぬゴロツキ退治,まつろわぬゴロツキ退治,旅をもてなす,概念礼装EXPカード：二代目は壱与！,骨,狂輝,狂ピ,黄茶葉,緑茶葉,大判,茶筅,,,,,,,
94074702,あやしい麦茶屋調査,あやしい麦茶屋調査,旅をもてなす,概念礼装EXPカード：二代目は壱与！,牙,術輝,術ピ,赤茶葉,黄茶葉,茶碗,大判,,,,,,,
94074703,襲来！ 茶花盗賊団,襲来！ 茶花盗賊団,旅をもてなす,概念礼装EXPカード：二代目は壱与！,証,殺輝,殺ピ,赤茶葉,緑茶葉,茶碗,茶筅,,,,,,,
94074704,冥界茶会はいづこ,冥界茶会はいづこ,旅をもてなす,概念礼装EXPカード：茶の湯ティーチャー,概念礼装EXPカード：二代目は壱与！,糸玉,矢尻,槍魔,槍輝,槍モ,赤茶葉,黄茶葉,緑茶葉,大判,茶筅,,,
94074705,迷子の案内人,迷子の案内人,旅をもてなす,概念礼装EXPカード：茶の湯ティーチャー,概念礼装EXPカード：二代目は壱与！,涙石,蛇玉,弓魔,弓輝,弓モ,赤茶葉,黄茶葉,緑茶葉,茶碗,大判,,,
